{
  "attempt_id": "imageattempt_2cd78dc9f9becf16347d",
  "attempt_number": 1,
  "credential_lookups": 0,
  "execution_mode": "platform_managed_tool",
  "expected_output_absent_at_seal": true,
  "expected_output_relative_path": "artifacts/slide_targets/imageattempt_2cd78dc9f9becf16347d/original.png",
  "external_provider_id": null,
  "external_transport_used": false,
  "platform_tool_id": "image_gen.imagegen",
  "prior_attempt_id": null,
  "prompt_hash": "9c261a4459daee26ea32436c9bf7c69e72c54acda8bcab01fbcfa7562fc161fb",
  "prompt_id": "prompt_d44bd2bc4a3712e882d8",
  "reference_artifacts": [
    {
      "artifact_id": "designboard_61f00a55ee02666b3254",
      "relative_path": "artifacts/design_board/imageattempt_841f1a2d3f85ffe84b12/normalized.png",
      "sha256": "a0229b8e27b4a103c177682b2d742ae3d4dd6eb9bb70c675cbf9f88293dd666d"
    },
    {
      "artifact_id": "moduleanchor_ffa35a3d6def1dfd4394",
      "relative_path": "artifacts/module_anchors/imageattempt_75c830b182fd0b7c79da/normalized.png",
      "sha256": "e0d530dc0b15be88b59d81c7126ce74b8aff4b00def199465801342e6f7ac9de"
    },
    {
      "artifact_id": "batchreference_9654720831fd18dc93f0",
      "relative_path": "artifacts/batch_references/imageattempt_f03ad42f2a12c3ddc487/normalized.png",
      "sha256": "ad6573245ba1210a49287ecda3561f2ba9a8ea4e52e5ea4a917b2bd4c5e8d6f1"
    }
  ],
  "repository_network_calls": 0,
  "request_id": "imagerequest_9004c266df9f97fa1022",
  "schema_name": "platform_image_attempt_seal",
  "schema_version": "1.0.0",
  "sealed_at": "2026-07-20T03:08:16.036+09:00",
  "target_artifact_id": "visualtarget_83244783582673b6aa13",
  "target_type": "slide_visual_target"
}
