{
  "attempt_id": "imageattempt_d28d1908a5c51365a84e",
  "attempt_number": 1,
  "credential_lookups": 0,
  "execution_mode": "platform_managed_tool",
  "expected_output_absent_at_seal": true,
  "expected_output_relative_path": "artifacts/slide_targets/imageattempt_d28d1908a5c51365a84e/original.png",
  "external_provider_id": null,
  "external_transport_used": false,
  "platform_tool_id": "image_gen.imagegen",
  "prior_attempt_id": null,
  "prompt_hash": "ef847d03ee2db78e20ef8709003e0944290dffc662cb915ceafb9767f6324e6c",
  "prompt_id": "prompt_5ce39172fe5fd4b3d912",
  "reference_artifacts": [
    {
      "artifact_id": "designboard_61f00a55ee02666b3254",
      "relative_path": "artifacts/design_board/imageattempt_841f1a2d3f85ffe84b12/normalized.png",
      "sha256": "a0229b8e27b4a103c177682b2d742ae3d4dd6eb9bb70c675cbf9f88293dd666d"
    },
    {
      "artifact_id": "moduleanchor_3591b43d6cf6fe339284",
      "relative_path": "artifacts/module_anchors/imageattempt_2502b789e69959c27135/normalized.png",
      "sha256": "632207323326068436325ea377f0477995de06e6e0de5546483c10e259b74f90"
    },
    {
      "artifact_id": "batchreference_3473bb414e4059c9bdd2",
      "relative_path": "artifacts/batch_references/imageattempt_83b2bd861408c6301c40/normalized.png",
      "sha256": "068c846fed83139b3cf25c5c79524db5a7ed74e6713179855faaf65fc41665f0"
    }
  ],
  "repository_network_calls": 0,
  "request_id": "imagerequest_6d2ff23632abd6204e31",
  "schema_name": "platform_image_attempt_seal",
  "schema_version": "1.0.0",
  "sealed_at": "2026-07-20T02:59:18.466+09:00",
  "target_artifact_id": "visualtarget_c917f32532dfa26b4560",
  "target_type": "slide_visual_target"
}
