{
  "attempt_id": "imageattempt_75c830b182fd0b7c79da",
  "attempt_number": 1,
  "credential_lookups": 0,
  "execution_mode": "platform_managed_tool",
  "expected_output_absent_at_seal": true,
  "expected_output_relative_path": "artifacts/module_anchors/imageattempt_75c830b182fd0b7c79da/original.png",
  "external_provider_id": null,
  "external_transport_used": false,
  "platform_tool_id": "image_gen.imagegen",
  "prior_attempt_id": null,
  "prompt_hash": "5793229da516a15ad50c42032728e55b6c7575bf2f1ddd0e59330513f602a755",
  "prompt_id": "prompt_634167014f48e24c3f42",
  "reference_artifacts": [
    {
      "artifact_id": "designboard_61f00a55ee02666b3254",
      "relative_path": "artifacts/design_board/imageattempt_841f1a2d3f85ffe84b12/normalized.png",
      "sha256": "a0229b8e27b4a103c177682b2d742ae3d4dd6eb9bb70c675cbf9f88293dd666d"
    }
  ],
  "repository_network_calls": 0,
  "request_id": "imagerequest_53f44536b557fd99fd5f",
  "schema_name": "platform_image_attempt_seal",
  "schema_version": "1.0.0",
  "sealed_at": "2026-07-20T02:50:06.423+09:00",
  "target_artifact_id": "moduleanchor_ffa35a3d6def1dfd4394",
  "target_type": "module_anchor"
}
