{
  "attempt_id": "imageattempt_f03ad42f2a12c3ddc487",
  "attempt_number": 1,
  "credential_lookups": 0,
  "execution_mode": "platform_managed_tool",
  "expected_output_absent_at_seal": true,
  "expected_output_relative_path": "artifacts/batch_references/imageattempt_f03ad42f2a12c3ddc487/original.png",
  "external_provider_id": null,
  "external_transport_used": false,
  "platform_tool_id": "image_gen.imagegen",
  "prior_attempt_id": null,
  "prompt_hash": "78bc2cb3401e512720eaa318921ead140fdb1138dea02628ab33daf3b2e641a8",
  "prompt_id": "prompt_ffc584e8c3eb6e8baa5c",
  "reference_artifacts": [
    {
      "artifact_id": "designboard_61f00a55ee02666b3254",
      "relative_path": "artifacts/design_board/imageattempt_841f1a2d3f85ffe84b12/normalized.png",
      "sha256": "a0229b8e27b4a103c177682b2d742ae3d4dd6eb9bb70c675cbf9f88293dd666d"
    },
    {
      "artifact_id": "moduleanchor_ffa35a3d6def1dfd4394",
      "relative_path": "artifacts/module_anchors/imageattempt_75c830b182fd0b7c79da/normalized.png",
      "sha256": "e0d530dc0b15be88b59d81c7126ce74b8aff4b00def199465801342e6f7ac9de"
    }
  ],
  "repository_network_calls": 0,
  "request_id": "imagerequest_9f656fdfc808b1fe10f2",
  "schema_name": "platform_image_attempt_seal",
  "schema_version": "1.0.0",
  "sealed_at": "2026-07-20T02:55:30.480+09:00",
  "target_artifact_id": "batchreference_9654720831fd18dc93f0",
  "target_type": "batch_template_reference"
}
