{
  "attempt_id": "imageattempt_70fe3aaea04afdff1d5f",
  "attempt_number": 1,
  "credential_lookups": 0,
  "execution_mode": "platform_managed_tool",
  "expected_output_absent_at_seal": true,
  "expected_output_relative_path": "artifacts/slide_targets/imageattempt_70fe3aaea04afdff1d5f/original.png",
  "external_provider_id": null,
  "external_transport_used": false,
  "platform_tool_id": "image_gen.imagegen",
  "prior_attempt_id": null,
  "prompt_hash": "e112f0d4da72a59046798e7a36b67df6b978161a7014178cd157dc20e4d5e619",
  "prompt_id": "prompt_8432c4afb1f268c3c089",
  "reference_artifacts": [
    {
      "artifact_id": "designboard_61f00a55ee02666b3254",
      "relative_path": "artifacts/design_board/imageattempt_841f1a2d3f85ffe84b12/normalized.png",
      "sha256": "a0229b8e27b4a103c177682b2d742ae3d4dd6eb9bb70c675cbf9f88293dd666d"
    },
    {
      "artifact_id": "moduleanchor_3591b43d6cf6fe339284",
      "relative_path": "artifacts/module_anchors/imageattempt_2502b789e69959c27135/normalized.png",
      "sha256": "632207323326068436325ea377f0477995de06e6e0de5546483c10e259b74f90"
    },
    {
      "artifact_id": "batchreference_3473bb414e4059c9bdd2",
      "relative_path": "artifacts/batch_references/imageattempt_83b2bd861408c6301c40/normalized.png",
      "sha256": "068c846fed83139b3cf25c5c79524db5a7ed74e6713179855faaf65fc41665f0"
    }
  ],
  "repository_network_calls": 0,
  "request_id": "imagerequest_a5d74ed0ac93d1c82bbd",
  "schema_name": "platform_image_attempt_seal",
  "schema_version": "1.0.0",
  "sealed_at": "2026-07-20T03:01:08.517+09:00",
  "target_artifact_id": "visualtarget_eb8bc3132476d2929014",
  "target_type": "slide_visual_target"
}
